Objective Tag,Objective Description,Evidence Statements,In BS1,In BS2,In CSP,CSP-Exclusions,Notes
,,Los resultados de las simulaciones pueden generar nuevos conocimientos y nuevas hipótesis relacionadas con los fenómenos que se está modelando.,N,,,,
,,"Las simulaciones permiten hipótesis a contrastar, sin las limitaciones del mundo real.",N,,,,
,,Las simulaciones pueden facilitar la prueba extensa y rápida de los modelos.,N,,,,
,,"El tiempo requerido para las simulaciones se ve afectada por el nivel de detalle y la calidad de los modelos, y el software y el hardware utilizado para la simulación.",N,,,,
,,La prueba rápida y extensa permite que los modelos sean cambiados para reflejar con precisión los objetos o fenómenos que está siendo modelado.,N,,,,
Data 3.1.1,"Utilizar los ordenadores para procesar la información, encontrar patrones, y probar hipótesis acerca de la información procesada digitalmente para ganar la penetración y el conocimiento. [P4]",Las computadoras se usan de forma iterativa e interactivo en el tratamiento de la información digital para ganar la penetración y el conocimiento.,N,,,,
,,La información digital se puede filtrar y limpiarse mediante el uso de ordenadores para procesar la información.,N,,,,
,,"La combinación de fuentes de datos, los datos de agrupamiento y clasificación de datos son parte del proceso de utilización de los ordenadores para procesar la información.",N,,,,
,,Visión y conocimiento se pueden obtener de la traducción y la transformación de la información representada digitalmente.,N,,,,
,,Los patrones pueden surgir cuando los datos se transformó utilizando herramientas computacionales.,N,,,,
Data 3.1.2,Colaborar en el tratamiento de la información para ganar la penetración y el conocimiento.,La colaboración es una parte importante de la solución de problemas basadas en datos.,N,,,,
,,"La colaboración facilita la resolución de problemas de cálculo mediante la aplicación de múltiples perspectivas, experiencias y habilidades.",N,,,,
,,La comunicación entre los participantes que trabajan en problemas basados ??en datos da lugar a ideas y conocimientos mejorados.,N,,,,
,,"Colaboración en el desarrollo de hipótesis y preguntas, y en la prueba de hipótesis y respondiendo preguntas, acerca de los datos ayuda a los participantes obtener una visión y conocimiento.",N,,,,
,,Colaborar cara a cara y el uso de herramientas de colaboración en línea puede facilitar el procesamiento de la información para ganar la penetración y el conocimiento.,N,,,,
,,La investigación de grandes conjuntos de datos en colaboración puede conducir a la comprensión y el conocimiento no se obtiene cuando se trabaja solo.,N,,,,
Data 3.1.3,"Explicar la visión y los conocimientos adquiridos a partir de los datos procesados ??digitalmente mediante el uso de visualizaciones apropiadas, anotaciones y lenguaje preciso.",Las herramientas de visualización y software pueden comunicar información sobre los datos.,N,,,,
,,"Tablas, diagramas y pantallas de texto se pueden utilizar en la comunicación de la penetración y el conocimiento obtenido de los datos.",N,,,,
,,Resúmenes de los datos analizados computacionalmente pueden ser eficaces en la comunicación de la penetración y el conocimiento obtenido de la información representada digitalmente.,N,,,,
,,La transformación de la información puede ser eficaz en la comunicación de los conocimientos obtenidos a partir de datos.,N,,,,
,,La interactividad con los datos es un aspecto de la comunicación.,N,,,,
Data 3.2.1,"Extraer información de los datos para descubrir y explicar las conexiones, patrones o tendencias.",grandes conjuntos de datos proporcionan oportunidades y desafíos para la extracción de la información y el conocimiento.,N,,,,
,,"grandes conjuntos de datos proporcionan oportunidades para la identificación de tendencias, hacer las conexiones en los datos, y la resolución de problemas.",N,,,,
,,herramientas informáticas facilitan el descubrimiento de las conexiones de la información dentro de grandes conjuntos de datos.,N,,,,
,,herramientas de búsqueda son esenciales para la búsqueda de información de manera eficiente.,N,,,,
,,sistemas de filtrado de información son herramientas importantes para la búsqueda de información y el reconocimiento de patrones en la información.,N,,,,
,,"Las herramientas de software, incluyendo hojas de cálculo y bases de datos, ayudan a organizar de manera eficiente y encontrar las tendencias de la información.",N,,,Declaración de la exclusión (3.2.1F): No se espera que los estudiantes sepan fórmulas u opciones específicas disponibles en paquetes de hojas de cálculo o software de base de datos ..,
,,Los metadatos son datos acerca de datos.,N,,,,
,,"Los metadatos pueden ser datos descriptivos sobre una imagen, una página web, u otros objetos complejos.",N,,,,
,,"Los metadatos pueden aumentar el uso eficaz de los datos o conjuntos de datos, proporcionando información adicional acerca de diversos aspectos de esos datos.",N,,,,
Data 3.2.2,El uso de grandes conjuntos de datos para explorar y descubrir la información y el conocimiento.,"grandes conjuntos de datos incluyen datos tales como transacciones, mediciones, texto, sonido, imágenes y vídeo.",N,,,,
,,"El almacenamiento, la transformación, y el comisariado de grandes conjuntos de datos es un reto.",N,,,,
,,La estructuración de grandes conjuntos de datos para el análisis puede ser un reto.,N,,,,
,,El mantenimiento de la privacidad de grandes conjuntos de datos que contienen información personal puede ser un reto.,N,,,,
,,Escalabilidad de los sistemas es una consideración importante cuando los conjuntos de datos son grandes.,N,,,,
,,El tamaño o escala de un sistema que almacena datos afecta la forma en que se utiliza el conjunto de datos.,N,,,,
,,El uso efectivo de grandes conjuntos de datos requiere soluciones computacionales.,N,,,,
,,"Las técnicas analíticas para almacenar, gestionar, difundir y conjuntos de datos de proceso cambian a medida que el tamaño de la escala de los conjuntos de datos.",N,,,,
Data 3.3.1,"Analizar cómo la representación de datos, almacenamiento, seguridad, y la transmisión de los datos implican la manipulación computacional de la información.","representaciones de datos digitales implican compensaciones relacionadas con las preocupaciones de almacenamiento, seguridad y privacidad.",N,,,,
,,Los problemas de seguridad engendran las compensaciones en el almacenamiento y transmisión de información.,N,,,,
,,Hay ventajas y desventajas en el uso de técnicas con pérdida y sin pérdida de compresión para almacenar y transmitir datos.,N,,,,
,,"la compresión de datos sin pérdidas reduce el número de bits almacenados o transmitidos, pero permite la reconstrucción completa de los datos originales.",N,,,,
,,la compresión de datos con pérdida puede reducir significativamente el número de bits almacenados o transmitidos en el costo de ser capaz de reconstruir sólo una aproximación de los datos originales.,N,,,,
,,Seguridad y privacidad preocupaciones surgen con los datos que contienen información personal.,N,,,,
,,"Los datos se almacenan en muchos formatos en función de sus características (por ejemplo, tamaño y uso previsto).",N,,,,
,,La elección del medio de almacenamiento afecta tanto a los métodos y los costes de manipulación de los datos que contiene.,N,,,,
,,La lectura de datos y la actualización de los datos tienen diferentes requisitos de almacenamiento.,N,,,,
Algorithms 4.1.1,Desarrollar un algoritmo para la implementación en un programa.,"Secuenciación, selección e iteración son bloques de construcción de algoritmos.",N,,,,
,,La secuencia es la aplicación de cada paso de un algoritmo en el orden en que se presentan los estados.,N,,,,
,,Selección utiliza una condición booleana para determinar cuál de las dos partes de un algoritmo se utiliza.,N,,,,
,,La iteración es la repetición de parte de un algoritmo hasta que se cumpla una condición o para un número determinado de veces.,N,,,,
,,Los algoritmos se pueden combinar para hacer nuevos algoritmos.,N,,,,
,,Usando algoritmos correctos existentes como bloques de construcción para la construcción de un nuevo algoritmo ayuda a asegurar el nuevo algoritmo es correcto.,N,,,,
,,El conocimiento de algoritmos estándar puede ayudar en la construcción de nuevos algoritmos.,N,,,,
,,Diferentes algoritmos se pueden desarrollar para resolver el mismo problema.,N,,,,
,,El desarrollo de un nuevo algoritmo para resolver un problema puede arrojar luz sobre el problema.,N,,,,
Algorithms 4.1.2,Expresar un algoritmo en un idioma.,"Idiomas para los algoritmos incluyen lenguaje natural, pseudocódigo, y lenguajes de programación visuales y textuales.",N,,,,
,,El lenguaje natural y pseudocódigo describen algoritmos para que los humanos pueden entender.,N,,,,
,,Algoritmos descritos en lenguajes de programación se pueden ejecutar en un ordenador.,N,,,,
,,Diferentes idiomas son más adecuados para expresar diferentes algoritmos.,N,,,,
,,Algunos lenguajes de programación están diseñados para dominios específicos y son mejores para expresar algoritmos en esos dominios.,N,,,,
,,"El lenguaje utilizado para expresar un algoritmo puede afectar a características tales como la claridad o la legibilidad, pero no si existe una solución algorítmica.",N,,,,
,,"Cada algoritmo puede construirse utilizando la secuenciación solamente, selección, y la iteración.",N,,,,
,,Casi todos los lenguajes de programación son equivalentes en términos de ser capaz de expresar cualquier algoritmo.,N,,,,
,,La claridad y la facilidad de lectura son consideraciones importantes en la expresión de un algoritmo en un lenguaje.,N,,,,
Algorithms 4.2.1,Explicar la diferencia entre los algoritmos que se ejecutan en un tiempo razonable y los que no se quede en un tiempo razonable.,Muchos problemas pueden ser resueltos en un tiempo razonable.,N,,,Declaración de la exclusión (LO 4.2.1): Cualquier discusión del polinomio no determinista (NP) está más allá del alcance de este curso y el examen AP.,
,,"tiempo razonable significa que a medida que crece el tamaño de entrada, el número de pasos que el algoritmo toma es proporcional al cuadrado (o cubo, cuarta potencia, quinta potencia, etc.) del tamaño de la entrada.",N,,,,
,,"Algunos problemas no pueden ser resueltos en un tiempo razonable, incluso para los pequeños tamaños de entrada.",N,,,,
,,"Algunos problemas se pueden resolver, pero no en un tiempo razonable. En estos casos, los enfoques heurísticas pueden ser útiles para encontrar soluciones en tiempo razonable.",N,,,,
Algorithms 4.2.2,Explicar la diferencia entre los problemas que tienen solución y sin solución en la informática.,Una heurística es una técnica que puede nos permitirá encontrar una solución aproximada en que los métodos típicos no logran encontrar una solución exacta.,N,,,Declaración de la exclusión (LO 4.2.2): La determinación de si un determinado problema es soluble o insoluble está más allá del alcance de este curso y el examen AP.,
,,Heurísticas pueden ser útiles para encontrar una solución aproximada con mayor rapidez cuando los métodos exactos son demasiado lentos.,N,,,Declaración de la exclusión (4.2.2B): soluciones heurísticas específicas están más allá del alcance de este curso y el examen AP.,
,,"Algunos problemas de optimización, tales como _find el mejor ""o _find el más pequeño"" no se puede resolver en un tiempo razonable, pero aproximaciones a la solución óptima puede.",N,,,,
,,Algunos problemas no se pueden resolver utilizando cualquier algoritmo.,N,,,,
Algorithms 4.2.3,Explicar la existencia de problemas indecidibles en la informática.,"Un problema undecidable puede tener instancias que tienen una solución algorítmica, pero no hay una solución algorítmica que resuelve todas las instancias del problema.",N,,,,
,,"Un problema decidible es uno en el que un algoritmo puede ser construido para responder a _Sí ""o _no"" para todas las entradas (por ejemplo, el número _is incluso? "").",N,,,,
,,Un problema indecidible es uno en el que ningún algoritmo puede ser construido de manera que siempre conduce a una correcta sí o ninguna respuesta.,N,,,Declaración de la exclusión (4.2.3C): La determinación de si un determinado problema es indecidible está más allá del alcance de este curso y el examen AP.,
Algorithms 4.2.4,"Evaluar los algoritmos de forma analítica y empíricamente para la eficiencia, exactitud y claridad.",La determinación de la eficiencia de un algoritmo s se realiza mediante un razonamiento formal o matemática sobre el algoritmo.,N,,,,
,,El análisis empírico de un algoritmo se realiza mediante la aplicación del algoritmo y ejecutarlo en diferentes entradas.,N,,,,
,,"La corrección de un algoritmo se determina por el razonamiento formal o matemáticamente sobre el algoritmo, no mediante pruebas de una implementación del algoritmo.",N,,,declaración de exclusión (4.2.4C): Formalmente probar la corrección del programa está más allá del alcance de este curso y el examen AP.,
,,Diferentes algoritmos correctos para un mismo problema pueden tener diferentes eficiencias.,N,,,,
,,"A veces, los algoritmos más eficientes son más complejas.",N,,,,
,,Encontrar un algoritmo eficiente para un problema puede ayudar a resolver grandes instancias del problema.,N,,,,
,,Eficiencia incluye tanto el tiempo de ejecución y el uso de memoria.,N,,,Declaración de la exclusión (4.2.4g): Análisis formal de algoritmos (Big-O) y el razonamiento formal utilizando fórmulas matemáticas están más allá del alcance de este curso y el examen AP.,
,,La búsqueda lineal se puede utilizar en la búsqueda de un elemento en cualquier lista; búsqueda binaria se puede utilizar sólo cuando la lista está ordenada.,N,,,,
Programming 5.1.1,"Desarrollar un programa para la expresión creativa, para satisfacer la curiosidad personal, o para crear nuevos conocimientos.",Los programas se desarrollan y se utilizan en una variedad de maneras por una amplia gama de personas en función de los objetivos del programador.,N,,,,
,,"Programas desarrollados para la expresión creativa, para satisfacer la curiosidad personal, o para crear nuevos conocimientos pueden tener entradas y salidas visuales, audibles o táctiles.",N,,,,
,,"Los programas desarrollados para la expresión creativa, para satisfacer la curiosidad personal, o para crear nuevos conocimientos podrán elaborarse con diferentes normas o métodos distintos programas desarrollados para su distribución generalizada.",N,,,,
,,Los resultados adicionales deseados pueden ejercerse independientemente del propósito original del programa.,N,,,,
,,"Un programa de ordenador o los resultados de la ejecución de un programa pueden comunicarse rápidamente con un gran número de usuarios y pueden tener un amplio impacto sobre los individuos, las organizaciones y la sociedad.",N,,,,
,,Los avances en la informática han generado y una mayor creatividad en otros campos.,N,,,,
Programming 5.1.2,Desarrollar un programa correcto para resolver problemas.,Un proceso iterativo de desarrollo del programa ayuda a desarrollar un programa correcto para resolver problemas.,N,,,,
,,El desarrollo de los componentes del programa correctas y luego combinarlos ayuda en la creación de programas correctos.,N,,,,
,,"la adición incremental de segmentos de programa para corregir probados, los programas de trabajo ayuda a crear grandes programas correctos.",N,,,,
,,documentación del programa ayuda a los programadores a desarrollar y mantener programas correctos para resolver problemas de manera eficiente.,N,,,,
,,"Documentación sobre los componentes del programa, tales como bloques y procedimientos, ayuda en el desarrollo y mantenimiento de programas.",N,,,,
,,Documentación de ayuda en el desarrollo y mantenimiento de programas cuando se trabaja individualmente o en entornos de programación de colaboración.,N,,,,
,,El desarrollo del programa incluye la identificación de usuario del programador y preocupaciones que afectan a la solución de problemas.,N,,,,
,,La consulta y la comunicación con los usuarios del programa es un aspecto importante del desarrollo de programas para resolver problemas.,N,,,,
,,conocimiento y habilidad Un programador s afecta a cómo se desarrolla un programa y cómo se utilizan para resolver un problema.,N,,,,
,,"Los diseños de un programador, implementa, pruebas, depura y mantiene programas en la resolución de problemas.",N,,,,
Programming 5.1.3,Colaborar en el desarrollo de un programa.,La colaboración puede disminuir el tamaño y complejidad de las tareas requeridas de programadores individuales.,N,,,,
,,La colaboración facilita múltiples perspectivas en el desarrollo de ideas para resolver problemas mediante la programación.,N,,,,
,,Colaboración en el desarrollo iterativo de un programa requiere diferentes habilidades que el desarrollo de un programa por sí solo.,N,,,,
,,La colaboración puede hacer que sea más fácil encontrar y corregir errores en el desarrollo de programas.,N,,,,
,,La colaboración facilita el desarrollo de los componentes del programa de forma independiente.,N,,,,
,,Se requiere una comunicación efectiva entre los participantes para el éxito de la colaboración en el desarrollo de programas.,N,,,,
Programming 5.2.1,Explican cómo los programas implementan algoritmos.,Los algoritmos se implementan mediante instrucciones de programa que se procesan durante la ejecución del programa.,N,,,,
,,Las instrucciones del programa se ejecutan secuencialmente.,N,,,,
,,"Las instrucciones del programa pueden incluir las variables que se inicializan y se actualizan, leen, y escritas.",N,,,,
,,La comprensión de procesamiento de instrucciones y la ejecución del programa es útil para la programación.,N,,,,
,,La ejecución del programa automatiza los procesos.,N,,,,
,,"Procesos de uso de memoria, una unidad de procesamiento central (CPU), y entrada y salida.",N,,,,
,,Un proceso puede ejecutar por sí mismo o con otros procesos.,N,,,,
,,Un proceso puede ejecutar en una o varias CPUs.,N,,,,
,,Los programas ejecutables aumentar la escala de los problemas que pueden abordarse.,N,,,,
,,algoritmos simples pueden resolver un gran conjunto de problemas cuando automatizado.,N,,,,
,,"Las mejoras en los algoritmos, el hardware, el software y aumentan los tipos de problemas y el tamaño de los problemas que pueden resolverse mediante la programación.",N,,,,
Programming 5.3.1,Utilice la abstracción para manejar la complejidad de los programas.,Los procedimientos son abstracciones de programación reutilizables.,N,,,,
,,Una función es una agrupación llamada de instrucciones de programación.,N,,,,
,,Procedimientos reducen la complejidad de la escritura y el mantenimiento de los programas.,N,,,,
,,Procedimientos tienen nombres y pueden tener parámetros y valores de retorno.,N,,,,
,,La parametrización se puede generalizar una solución específica.,N,,,,
,,Parámetros generalizan una solución al permitir una función para utilizar en lugar de código duplicado.,N,,,,
,,Parámetros proporcionan valores diferentes como entrada a los procedimientos cuando se les llama en un programa.,N,,,,
,,Abstracción de datos proporciona un medio de separación de comportamiento de la aplicación.,N,,,,
,,"Cuerdas y operaciones de cadenas, incluyendo concatenación y alguna forma de subcadena, son comunes en muchos programas.",N,,,,
,,Números enteros y números en coma flotante se utilizan en los programas sin necesidad de comprensión de cómo se implementan.,N,,,,
,,"Las listas y la lista de operaciones, tales como agregar, eliminar y búsqueda, son comunes en muchos programas.",N,,,,
,,El uso de listas y procedimientos como abstracciones de programación puede dar lugar a programas que son más fáciles de desarrollar y mantener.,N,,,,
,,interfaces de programación de aplicaciones (API) y las bibliotecas de simplificar las tareas complejas de programación.,N,,,,
,,Documentación para una API / biblioteca es un aspecto importante de la programación.,N,,,,
,,"API conectan los componentes de software, que les permite comunicarse.",N,,,,
Programming 5.4.1,Evaluar la exactitud de un programa.,estilo de programa puede afectar a la determinación de la corrección del programa.,N,,,,
,,Código duplicado puede hacer que sea más difícil de razonar acerca de un programa.,N,,,,
,,nombres significativos para las variables y procedimientos ayudan a la gente a entender mejor los programas.,N,,,,
,,bloques de código más largas son más difíciles de razonar acerca de los bloques de código más cortas en un programa.,N,,,,
,,Localizar y corregir errores en un programa que se llama el programa de depuración.,N,,,,
,,Se requiere un conocimiento de lo que un programa se supone que debe hacer con el fin de encontrar la mayoría de los errores del programa.,N,,,,
,,Ejemplos de comportamiento previsto en los insumos específicos ayudan a la gente a entender lo que se supone que un programa para hacer.,N,,,,
,,Los visualizadores (o diferentes modalidades) de estado del programa pueden ayudar en la búsqueda de errores.,N,,,,
,,Los programadores justificar y explicar la corrección de un programa s.,N,,,,
,,Justificación puede incluir una explicación por escrito sobre cómo un programa cumple sus especificaciones.,N,,,,
,,"La corrección de un programa depende de la exactitud de los componentes del programa, incluidos los tacos y los procedimientos de código.",N,,,,
,,Una explicación de un programa de ayuda a la gente a entender la funcionalidad y el propósito de la misma.,N,,,,
,,La funcionalidad de un programa se describe a menudo por cómo un usuario interactúa con él.,N,,,,
,,"La funcionalidad de un programa se describe mejor a un alto nivel por lo que hace el programa, no en el nivel inferior de la forma en las sentencias de programa de trabajo para lograr esto.",N,,,,
Programming 5.5.1,Emplear los conceptos matemáticos y lógicos adecuados en la programación.,Los números y conceptos numéricos son fundamentales para la programación.,N,,,,
,,Los enteros pueden estar limitados en los valores máximos y mínimos que se pueden representar en un programa debido a limitaciones de almacenamiento.,N,,,Declaración de la exclusión (5.5.1B): limitaciones en el alcance específico de todos los lenguajes de programación están más allá del alcance de este curso y el examen AP.,
,,"Los números reales se aproximan mediante representaciones de punto flotante, que no necesariamente tienen una precisión infinita.",N,,,Declaración de la exclusión (5.5.1C): conjuntos específicos de los valores que no pueden ser exactamente representados por números en coma flotante están más allá del alcance de este curso y el examen AP.,
,,Las expresiones matemáticas que utilizan operadores aritméticos son parte de la mayoría de los lenguajes de programación.,N,,,,
,,conceptos lógicos y el álgebra de Boole son fundamentales para la programación.,N,,,,
,,"expresiones compuestas utilizando y, o, y no forman parte de la mayoría de los lenguajes de programación.",N,,,,
,,razonamiento intuitivo y formal sobre los componentes del programa que utilizan los conceptos de Boole ayuda en el desarrollo de programas correctos.,N,,,,
,,métodos computacionales pueden utilizar listas y colecciones para resolver problemas.,N,,,,
,,Las listas y otras colecciones se pueden tratar como tipos de datos abstractos (ADT) en los programas de desarrollo.,N,,,,
,,"Funciones básicas de colecciones incluyen la adición de elementos, eliminar elementos, se itera sobre todos los elementos, y determinar si un elemento está en una colección.",N,,,,
Internet 6.1.1,Explicar las abstracciones en Internet y cómo funciona Internet.,La Internet conecta los dispositivos y redes de todo el mundo.,N,,,Declaración de la exclusión (LO 6.1.1): dispositivos específicos utilizados para implementar las abstracciones en Internet están más allá del alcance de este curso y el examen AP.,
,,Una arquitectura de extremo a extremo facilita la conexión de nuevos dispositivos y redes de Internet.,N,,,,
,,Dispositivos y redes que conforman Internet están conectados y se comunican usando direcciones y protocolos.,N,,,,
,,La Internet y los sistemas construidos en él facilitan la colaboración.,N,,,,
,,La conexión de nuevos dispositivos a Internet está habilitada por la asignación de una dirección de protocolo de Internet (IP).,N,,,,
,,"Internet se basa en la evolución de las normas, incluidas las de direcciones y nombres.",N,,,Declaración de la exclusión (6.1.1F): Los detalles específicos de cualquier norma en particular para las direcciones están más allá del alcance de este curso y el examen AP.,
,,El sistema de nombres de dominio (DNS) traduce los nombres a direcciones IP.,N,,,,
,,El número de dispositivos que podrían utilizar una dirección IP ha crecido tan rápido que un nuevo protocolo (IPv6) se ha establecido para manejar el enrutamiento de muchos más dispositivos.,N,,,,
,,"Normas tales como el protocolo de transferencia de hipertexto (HTTP), IP, y el protocolo simple de transferencia de correo (SMTP) se desarrollan y supervisados ??por la Internet Engineering Task Force (IETF).",N,,,,
Internet 6.2.1,Explicar las características de Internet y los sistemas construidos sobre el mismo.,La Internet y los sistemas construidos en él son jerárquicos y redundante.,N,,,,
,,La sintaxis del nombre de dominio es jerárquico.,N,,,,
,,Las direcciones IP son jerárquicas.,N,,,,
,,Enrutamiento en Internet es tolerante a fallos y redundantes.,N,,,,
