Objective Tag,Objective Description,Evidence Statements,In BS1,In BS2,In CSP,CSP-Exclusions,Notes
Internet 6.2.2,Explicar cómo las características de Internet influyen en los sistemas construidos sobre el mismo.,escalar los sistemas de jerarquía y ayudar a la redundancia.,N,,,,
,,"La redundancia de enrutamiento (es decir, más de una forma de datos de la ruta) entre dos puntos en Internet aumenta la fiabilidad de Internet y ayuda a escalar a más dispositivos y más personas.",N,,,,
,,Jerarquía en el DNS ayuda a que la escala del sistema.,N,,,,
,,Interfaces y protocolos permiten el uso generalizado de la Internet.,N,,,,
,,Los estándares abiertos alimentan el crecimiento de Internet.,N,,,,
,,"La Internet es un sistema de conmutación de paquetes a través del cual los datos digitales es enviado por dividir los datos en bloques de bits llamados paquetes, que contienen tanto los datos que se transmiten e información de control para el encaminamiento de los datos.",N,,,"Las declaraciones de exclusión (6.2.2F): Los detalles específicos de cualquier sistema de conmutación de paquetes particular, están más allá del alcance de este curso y el examen AP.",
,,Normas para los paquetes y enrutamiento incluyen Transmission Control Protocol / Internet Protocol (TCP / IP).,N,,,Declaración de la exclusión (6.2.2G): detalles técnicos específicos de cómo funciona el TCP / IP están más allá del alcance de este curso y el examen AP.,
,,Los estándares para el intercambio de información y la comunicación entre los navegadores y servidores de la Web incluyen HTTP y Secure Sockets Layer / transporte de seguridad de la capa (SSL / TLS).,N,,,Declaración de la exclusión (6.2.2H): La comprensión de los aspectos técnicos de cómo funciona SSL / TLS está más allá del alcance de este curso y el examen AP.,
,,El tamaño y la velocidad de los sistemas afectan a su uso.,N,,,,
,,El ancho de banda de un sistema es una medida de la velocidad de bits † la cantidad de datos (medida en bits) que puede ser enviada en una cantidad fija de tiempo.,N,,,,
,,La latencia de un sistema es el tiempo transcurrido entre la transmisión y la recepción de una petición.,N,,,,
Internet 6.3.1,Identificar las preocupaciones de seguridad cibernética existentes y las posibles opciones para hacer frente a estos problemas con Internet y los sistemas construidos sobre el mismo.,El modelo de confianza de Internet implica ventajas y desventajas.,N,,,,
,,El sistema de nombres de dominio (DNS) no fue diseñado para ser completamente seguro.,N,,,,
,,"La implementación de la seguridad cibernética tiene un software, hardware y componentes humanos.",N,,,,
,,La guerra cibernética y delitos cibernéticos tienen efectos generalizados y potencialmente devastadoras.,N,,,,
,,ataques distribuidos de denegación de servicio (DDoS) en peligro un objetivo inundándolo con las peticiones de los múltiples sistemas.,N,,,,
,,"Phishing, virus y otros ataques tienen componentes humanos y software.",N,,,,
,,software de cortafuegos y antivirus pueden ayudar a prevenir el acceso no autorizado a los datos privados.,N,,,,
,,La criptografía es esencial para muchos modelos de seguridad cibernética.,N,,,,
,,La criptografía tiene un fundamento matemático.,N,,,declaración de exclusión (6.3.1I): funciones matemáticas específicas utilizadas en la criptografía están más allá del alcance de este curso y el examen AP.,
,,Los estándares abiertos ayudan a asegurar la criptografía es seguro.,N,,,,
,,El cifrado simétrico es un método de cifrado que involucra una clave para el cifrado y el descifrado.,N,,,Declaración de la exclusión (6.3.1K): Los métodos utilizados en el cifrado están más allá del alcance de este curso y el examen AP.,
,,"cifrado de clave pública, que no es simétrica, es un método de cifrado que se utiliza ampliamente debido a la mayor seguridad asociados con su uso.",N,,,declaración de exclusión (6.3.1L): Los métodos matemáticos utilizados en el cifrado de clave pública están más allá del alcance de este curso y el examen AP.,
,,autoridades de certificación (CA) emiten certificados digitales para validar la propiedad de claves cifradas utilizados en comunicaciones seguras y se basan en un modelo de confianza.,N,,,declaración de exclusión (6.3.1M): Los detalles técnicos del proceso de autoridades de certificación siguen están más allá del alcance de este curso y el examen AP.,
Global Impact 7.1.1,"Explica cómo las innovaciones de computación afectan a la comunicación, la interacción y la cognición.","Correo electrónico, servicio de mensajes cortos (SMS), y chat han fomentado nuevas formas de comunicarse y colaborar.",N,,,,
,,videoconferencia y chat de vídeo han fomentado nuevas formas de comunicarse y colaborar.,N,,,,
,,Los medios sociales sigue evolucionando y fomentar nuevas formas de comunicación.,N,,,Declaración de la exclusión (7.1.1C): El conocimiento detallado de cualquier sitio de redes sociales está más allá del alcance de este curso y el examen AP.,
,,La computación en nube fomenta nuevas formas de comunicarse y colaborar.,N,,,,
,,"El acceso generalizado a la información facilita la identificación de problemas, desarrollo de soluciones y difusión de los resultados.",N,,,,
,,Los datos públicos ofrece un amplio acceso y permite soluciones a los problemas identificados.,N,,,,
,,las tendencias de búsqueda son predictores.,N,,,,
,,"Los medios sociales, como blogs y Twitter, han mejorado la difusión.",N,,,,
,,"Sistema de Posicionamiento Global (GPS) y tecnologías relacionadas han cambiado la forma de viajar seres humanos, navegar y buscar información relacionada con la geolocalización.",N,,,,
,,Las redes de sensores facilitan nuevas formas de interactuar con el entorno y con los sistemas físicos.,N,,,,
,,"Las redes inteligentes, edificios inteligentes, y el transporte inteligentes están cambiando y facilitar las capacidades humanas.",N,,,,
,,Computación contribuye a muchas tecnologías de asistencia que mejoran las capacidades humanas.,N,,,,
,,El Internet y la Web han mejorado los métodos y las oportunidades de comunicación y colaboración.,N,,,,
,,"El Internet y la Web han cambiado muchas áreas, incluyendo el comercio electrónico, servicios de salud, el acceso a la información y el entretenimiento, y el aprendizaje en línea.",N,,,,
,,"El Internet y la Web han impactado la productividad, positiva y negativamente, en muchas áreas.",N,,,,
Global Impact 7.1.2,Explicar cómo las personas participan en un proceso de resolución de problemas que escala.,Las soluciones descentralizadas deben escalar para resolver algunos problemas.,N,,,,
,,"La ciencia ha sido afectada por el uso de la escala y la ciencia _citizen ""para resolver problemas científicos que utilizan los ordenadores personales en la investigación científica.",N,,,,
,,arneses de cálculo humanos contribuciones de muchos seres humanos para resolver problemas relacionados con los datos digitales y la Web.,N,,,,
,,Las capacidades humanas se ven reforzadas por la colaboración habilitada digitalmente.,N,,,,
,,Algunos servicios en línea utilizan las contribuciones de muchas personas para beneficiar tanto a los individuos y la sociedad.,N,,,,
,,"Crowdsourcing ofrece nuevos modelos de colaboración, como la conexión de las personas con puestos de trabajo y las empresas con financiación.",N,,,,
,,El paso de los ordenadores de sobremesa a una proliferación de siempre en los equipos móviles está dando lugar a nuevas aplicaciones.,N,,,,
Global Impact 7.2.1,Explica cómo la computación ha impactado innovaciones en otros campos.,"El aprendizaje automático y minería de datos han permitido la innovación en medicina, los negocios y la ciencia.",N,,,,
,,computación científica ha permitido la innovación en la ciencia y los negocios.,N,,,,
,,"Computing permite la innovación, proporcionando el acceso y el intercambio de información.",N,,,,
,,El acceso libre y Creative Commons han permitido un amplio acceso a la información digital.,N,,,,
,,bases de datos científicas abiertas y curada se han beneficiado los investigadores científicos.,N,,,,
,,la ley de Moore s ha animado a las industrias que utilizan los ordenadores para planificar eficazmente la investigación y el desarrollo futuro basado en los aumentos previstos en la potencia de cálculo.,N,,,,
,,Los avances en la computación como una tecnología habilitadora han generado y el aumento de la creatividad en otros campos.,N,,,,
Global Impact 7.3.1,Analizar los efectos beneficiosos y perjudiciales de la computación.,Innovaciones habilitadas por la informática plantea problemas legales y éticos.,N,,,,
,,acceso comercial a las descargas de música y películas en streaming y plantea problemas legales y éticos.,N,,,,
,,El acceso a los contenidos digitales a través de redes peer-to-peer plantea problemas legales y éticos.,N,,,,
,,Tanto autenticado y anónimo acceso a la información digital plantea problemas legales y éticos.,N,,,,
,,la censura comercial y gubernamental de la información digital plantea problemas legales y éticos.,N,,,,
,,El código abierto y licencia de software y contenido traer problemas legales y éticos.,N,,,,
,,surgen de privacidad y seguridad en el desarrollo y uso de sistemas computacionales y artefactos.,N,,,,
,,"La agregación de la información, tales como geolocalización, cookies y el historial de navegación, plantea problemas de privacidad y seguridad.",N,,,,
,,El anonimato en las interacciones en línea se puede activar mediante el uso de servidores proxy y software de anonimato en línea.,N,,,,
,,"La tecnología permite la recopilación, uso y explotación de la información acerca de, por y para las personas, grupos e instituciones.",N,,,,
,,La gente puede tener acceso instantáneo a grandes cantidades de información en línea; el acceso a esta información puede permitir la recogida de datos tanto individuales y agregados que se pueden usar y se recoge.,N,,,,
,,curación comercial y gubernamental de la información puede ser explotado si la privacidad y otras protecciones son ignorados.,N,,,,
,,"La publicidad dirigida se utiliza para ayudar a las personas, pero puede ser mal utilizada tanto a nivel individual y agregado.",N,,,,
,,El acceso generalizado a la información digitalizada plantea preguntas acerca de la propiedad intelectual.,N,,,,
,,"Creación de audio digital, vídeo y contenido textual mediante la combinación de contenido existente se ha visto afectada por las preocupaciones de derechos de autor.",N,,,,
,,La Ley de Derechos de Autor del Milenio Digital (DMCA) ha sido un beneficio y un reto en la fabricación de material digital con derechos de autor ampliamente disponibles.,N,,,,
,,"El código abierto y el software libre tienen efectos prácticos, comerciales y éticos sobre el acceso generalizado a los programas, bibliotecas, y el código.",N,,,,
Global Impact 7.4.1,"Explicar las conexiones entre la informática y los contextos económicos, sociales y culturales.",La innovación y el impacto de los medios sociales y el acceso en línea es diferente en diferentes países y en diferentes grupos socioeconómicos.,N,,,,
,,"Móviles, inalámbricas y redes computacionales tienen un impacto sobre la innovación en todo el mundo.",N,,,,
,,"La distribución global de los recursos informáticos plantea problemas de equidad, el acceso y el poder.",N,,,,
,,"Grupos y personas se ven afectadas por la ""brecha digital"" - que difieren acceso a la informática y de Internet basado en las características socioeconómicas o geográficas.",N,,,,
,,Redes e infraestructuras son compatibles con ambas iniciativas comerciales y gubernamentales.,N,,,,
Global Impact 7.5.1,,bases de datos y bibliotecas en línea el catálogo y la casa secundaria y algunas fuentes primarias.,N,,,,
,,"Avanzar en herramientas de búsqueda, la lógica booleana, y las palabras clave pueden filtrar los resultados de búsqueda de búsqueda de enfoque y / o límite basados ??en una variedad de factores (por ejemplo, datos, el estado de revisión por pares, los tipos de publicación)",N,,,,
,,El plagio es un delito grave que ocurre cuando una persona presenta ideas o palabras de otro como su propio. El plagio puede evitarse fuentes acknowledgin precisión.,N,,,,
Global Impact 7.5.2,,"Determing la credibilidad de una fuente requiere considerar y evaluar la reputación y las credenciales del autor (s), editor (s), propietario (s) sitio, y / o el patrocinador (s).",N,,,,
,,Información de una fuente se considera relevante cuando se admite una reclamación correspondiente o el propósito de la investigación.,N,,,,
