Objective Tag,Objective Description,Evidence Statements,In BS1,In BS2,In DS,In CSP,CSP-Exclusions,Notes
S-ID.1-4,The student uses data summary techniques to aid interpretation of a single count or measurement variable,"1. plots on the real number line (dot plots, histograms, and box plots) to represent data",N,,Y,,,
,,"2. comparison of two or more different data sets by measure of center (median, mean) and spread (interquartile range) appropriate to the shape of the data distribution",N,,Y,,,
S-ID.5-6,The student uses data summary techniques to aid interpretation of two categorical and quantitative variables,1. use of two-way frequency tables to summarize categorical data for two categories,N,,N,,,
,,"2. interpretation of relative frequencies in the context of the data (including joint, marginal, and conditional relative frequencies)",N,,N,,,
,,3. identification of possible associations and trends in the data,N,,Y,,,
,,4. use of a scatter plot to represent data on two quantitative variables and describe how the variables are related,N,,Y,,,
,,"5. use of a given linear, quadratic, or exponential function to match a function to the data",N,,N,,,
,,6. use of functions fitted to data to solve problems in the context of the data,N,,Y,,,
,,7. informal assessment of the fit of a function by plotting and analyzing residuals,N,,N,,,
,,8. determination of a linear function for a scatter plot that suggests a linear association,N,,Y,,,
S-ID.7-9,The student interprets linear models representing data,1. use of the context of the data to interpret the slope (rate of change) and the intercept (constant term) of a linear model,N,,Y,,,
,,2. use of technology to compute (using technology) and interpret the correlation coefficient of a linear fit,N,,Y,,,
,,3. identification of the difference between correlation and causation,N,,Y,,,
N-CN,"The student performs operations (addition, subtraction, and multiplication) with complex numbers","1. use of the imaginary number i, such that i^2 = _1, to write complex numbers in the form a + bi with a and b real",N,,N,,,
,,"2. use of the commutative, associative, and distributive properties to add, subtract, and multiply complex numbers",N,,N,,,
N-CN.7,The student uses complex numbers in polynomial identities and equations,1. solution of quadratic equations with real coefficients that have complex solutions,N,,N,,,
,,2. solution of problems using equations and inequalities in one variable,N,,N,,,
,,3. representation of relationships between two quantities by equations in two or more variables,N,,N,,,
,,4. use of coordinate axes with labels and scales to graph equations,N,,N,,,
,,"5. use of problem constraints to interpret solutions as viable or nonviable in modeling an equation, inequality, or systems of equations and/or inequalities",Y,,N,,,
,,6. manipulation of a formula to solve for a specific variable to highlight a particular quantity of interest,N,,N,,,
F-BF.1-2,The student models a relationship between two quantities by building a function,4. use of recursive and explicit formulas to write arithmetic and geometric sequences to model situations,N,,N,,,
,,5. translation between recursive and explicit forms,N,,N,,,
F-BF.3-4,The student builds new functions from existing functions.,"1. identification of the effect on the graph of replacing f(x) by f(x) + k, k f(x), f(kx), and f(x + k) for specific values of k (both positive and negative)",N,,N,,,
,,2. determination of the value of k given a graph,N,,N,,,
,,3. use of technology to experiment with cases to illustrate and explain the effect algebraic changes have on the graph of a function,N,,N,,,
,,4. inversion of a function,N,,N,,,
,,5. solution of an equation of the form f(x) = c for a simple function f that has an inverse in order to write the inverse,N,,N,,,
F-TF.1-2,The student uses the unit circle to extend the domain of trigonometric functions,1. use of radian measure to represent the length of the arc on the unit circle subtended by the angle,N,,N,,,
,,2. extension of trigonometric functions to all real numbers using the unit circle in the coordinate plane,N,,N,,,
,,3 interpretation of radian measures as angles traversed counterclockwise around the unit circle,N,,N,,,
F-TF.5,The student models periodic phenomena with trigonometric functions,"1. selection of trigonometric functions that model periodic phenomena with specified amplitude, frequency, and midline",N,,N,,,
F-TF.8,The student uses trigonometric identities in proofs and application,"1. use of the Pythagorean identity sin2(_) + cos2(_) = 1 to find sin(_), cos(_), or tan(_) given sin(_), cos(_), or tan(_) and the quadrant of the angle",N,,N,,,
G-GPE.1-2,The student translates between the geometric description and the equation for a conic section,3. use of a given focus and directrix to derive the equation of a parabola,N,,N,,,
S-IC.1-2,The student evaluates random processes underlying statistical experiments,1. explanation of statistics as a process for making inferences about population parameters based on a random sample from that population,N,,Y,,,
,,2. determination whether a specified model is consistent with results from a given data-generating process,N,,Y,,,
S-IC.3-6,"The student makes justifiable inferences from sample surveys, experiments, and observational studies","1. identification of the purposes of and differences among sample surveys, experiments, and observational studies",N,,,,,
,,"2. explanation of how randomization relates to sample surveys, experiments, and observational studies",N,,,,,
,,3. use of data from a sample survey to estimate a population mean or proportion,N,,Y,,,
,,4. use of simulation models for random sampling to develop a margin of error,N,,,,,
,,5. use of data from a randomized experiment to compare two treatments,N,,,,,
,,6. use of simulations to decide if differences between parameters are significant,N,,,,,
,,7. evaluation of reports based on data,N,,Y,,,
S-CP.1-5,The student uses independence and conditional probability to interpret data,1. description of events as subsets of a sample space (the set of outcomes) using characteristics (or categories) of the outcomes,N,,N,,,
,,"2. use of unions, intersections, or complements to describe events",N,,N,,,
,,3. determination of whether two events A and B are independent by identifying the probability of A and B occurring together as the product of their individual probabilities,N,,N,,,
,,4. identification of conditional probability of A given B as P(A and B)/P(B),N,,N,,,
,,"5. interpretation of independence of A and B as saying that the conditional probability of A given B is the same as the probability of A, and the conditional probability of B given A is the same as the probability of B",N,,N,,,
,,6. construction and interpretation of two-way frequency tables of data when two categories are associated with each object being classified,N,,N,,,
,,7. use of the two-way table as a sample space to decide if events are independent and to approximate conditional probabilities,N,,N,,,
,,8. use of everyday language and situations to explain the concepts of conditional probability and independence,N,,N,,,
S-CP.6-7,The student computes probabilities of compound events in a uniform probability model using the rules of probability,"1. determination of the conditional probability of A given B as the fraction of B's outcomes that also belong to A, and interpret the answer in terms of the model",N,,N,,,
,,"2. determination of the conditional probability of A given B as the fraction of B's outcomes that also belong to A, and interpret the answer in terms of the model.",N,,N,,,
HSS.ID.A,"Summarize, represent, and interpret data on a single count or measurement variable","Represent data with plots on the real number line (dot plots, histograms, and box plots).",N,,Y,,,
,,"Use statistics appropriate to the shape of the data distribution to compare center (median, mean) and spread (interquartile range, standard deviation) of two or more different data sets.",N,,Y,,,
,,"Interpret differences in shape, center, and spread in the context of the data sets, accounting for possible effects of extreme data points (outliers).",N,,Y,,,
,,"Use the mean and standard deviation of a data set to fit it to a normal distribution and to estimate population percentages. Recognize that there are data sets for which such a procedure is not appropriate. Use calculators, spreadsheets, and tables to estimate areas under the normal curve.",N,,N,,,
HSS.ID.B,"Summarize, represent, and interpret data on two categorical and quantitative variables","Summarize categorical data for two categories in two-way frequency tables. Interpret relative frequencies in the context of the data (including joint, marginal, and conditional relative frequencies). Recognize possible associations and trends in the data.",N,,N,,,
,,"Represent data on two quantitative variables on a scatter plot, and describe how the variables are related.",N,,Y,,,
,,"Fit a function to the data; use functions fitted to data to solve problems in the context of the data. Use given functions or choose a function suggested by the context. Emphasize linear, quadratic, and exponential models.",N,,Y,,,
,,Informally assess the fit of a function by plotting and analyzing residuals.,N,,N,,,
,,Fit a linear function for a scatter plot that suggests a linear association.,N,,Y,,,
HSS.ID.C,Interpret linear models,Interpret the slope (rate of change) and the intercept (constant term) of a linear model in the context of the data.,N,,Y,,,
,,Compute (using technology) and interpret the correlation coefficient of a linear fit.,N,,Y,,,
,,Distinguish between correlation and causation.,N,,Y,,,
HSS.IC.A,Understand and evaluate random processes underlying statistical experiments,Understand statistics as a process for making inferences about population parameters based on a random sample from that population.,N,,N,,,
,,"Decide if a specified model is consistent with results from a given data-generating process, e.g., using simulation. For example, a model says a spinning coin falls heads up with probability 0.5. Would a result of 5 tails in a row cause you to question the model?",N,,N,,,
HSS.IC.B,"Make inferences and justify conclusions from sample surveys, experiments, and observational studies","Recognize the purposes of and differences among sample surveys, experiments, and observational studies; explain how randomization relates to each.",N,,N,,,
,,Use data from a sample survey to estimate a population mean or proportion; develop a margin of error through the use of simulation models for random sampling.,N,,N,,,
,,Use data from a randomized experiment to compare two treatments; use simulations to decide if differences between parameters are significant.,N,,N,,,
,,Evaluate reports based on data.,N,,N,,,
BS-M,The student models a problem in context and determines the data needed to describe the problem,identifying which quantities are fixed and which are variable,Y,,Y,,,
,,"identifying the datatype of a given quantity, in context",Y,,Y,,,
,,identifying the difference between types and values,Y,,Y,,,
BS-CE,"The student translates between structured expressions as arithmetic, code, and Circles of Evaluation",translating a simple (1-operation) equation into a Circle of Evaluation,Y,,N,,,
,,translating a nested (multi-operation) equation into a Circle of Evaluation,Y,,N,,,
,,translating a Circle of Evaluation into its equivalent arithmetic expression,Y,,N,,,
,,translating a Circle of Evaluation into its equivalent programming syntax,Y,,N,,,
BS-IDE,"The student is familiar with using a REPL, entering expressions properly, and interpreting error messages",enter and evaluate expressions on the computer,Y,,Y,,,
,,look to error messages as a way of diagnosing syntax errors,Y,,Y,,,
BS-PL.1,The student is familiar with declaring values and applying built-in functions using the programming language,"representing (numeric, string, boolean, image, etc) values in the programming language",Y,,Y,,,
,,interpreting a function application and identifying its arguments,Y,,Y,,,
BS-PL.2,The student is comfortable using and writing Contracts for built-in functions,representing a function's input and output using a contract,Y,,Y,,,
,,using a function by refering to its contract,Y,,Y,,,
BS-PL.3,The student is able to use the syntax of the programming language to define values and functions,defining and retrieving values,Y,,Y,,,
,,writing test cases,Y,,Y,,,
,,defining and using functions,Y,,Y,,,
BS-PL.4,The student is familiar with the syntax for conditionals,defining and using functions than involve conditionals,Y,,N,,,
BS-DR.1,The student is able to translate a word problem into a Contract and Purpose Statement,"given a word problem, identify the domain and range of a function",Y,,Y,,,
,,"given a word problem, write a Purpose Statement (i.e. - rewrite the problem in their own words)",Y,,Y,,,
BS-DR.2,The student can derive test cases for a given contract and purpose statement,"given a Contract and a Purpose Statement, write multiple examples or test cases",Y,,Y,,,
,,"identifying correct and incorrect test cases for a function, based on its contract",Y,,Y,,,
,,"given multiple examples, identify patterns in order to label and name the variables",Y,,N,,,
BS-DR.3,"Given multiple test cases, the student can define a function","given examples and labeled variable(s), define the function",Y,,N,,,
,,"identifying correct and incorrect definitions for a function, based on its test cases",Y,,,,,
BS-DR.4,The student can solve word problems that involve data structures,write examples for a function that prodiuces a data structure,N,N,Y,,,
,,write functions that produce data structures,N,N,Y,,,
,,write piecewise functions that consume and produce data structures,N,N,N,,,
BS-DS.1,The student is able to read data blocks,"given a data block, identify that it is a data structure",N,Y,N,,,
,,"given a data block, identify the constructor function and dot-accessors",N,Y,N,,,
,,"given a data block, identify the correct datatypes for each field of that structure",N,Y,N,,,
,,"given a data block, create instances of the data structure",N,N,N,,,
,,"given a data block, use dot-accessors to access fields of the data structure",N,N,N,,,
BS-DS.2,The student is able to solve problems using data structures,identify problems that require use of a data structure,N,N,N,,,
,,"given a problem, define a data structure",N,N,N,,,
,,add fields to a pre-existing data structure,N,N,N,,,
BS-R,The student is able to write interactive programs using the 'Reactor' construct,identify how an updating function changes a data structure,N,Y,N,,,
,,identify how a drawing function creates a static image,N,Y,N,,,
,,identify how a reactor uses drawing and updating functions to create an animation,N,N,N,,,
,,identify how functions work together to create and maintain a complex program,N,N,N,,,
,,modify parts of a complex program by altering functions or data structures,N,N,N,,,
BS-PL.P,The Student is comfortable using the Pyret syntax for the Design Recipe,,N,N,Y,,,appears unused
MP.1,Make sense of problems and persevere in solving them,,Y,,Y,,,
MP.2,Reason abstractly and quantitatively,,N,,Y,,,
MP.3,Construct viable arguments and critique the reasoning of others,,N,,Y,,,
MP.4,Model with mathematics,,N,,Y,,,
MP.5,Use appropriate tools strategically,,N,,Y,,,
MP.6,Attend to precision,,N,,Y,,,
MP.7,Look for and make use of structure,,Y,,Y,,,
111.47.4,Categorical and quantitative data. The student applies the mathematical process standards to represent and analyze both categorical and quantitative data.,Distinguish between categorical and quantitative data,,,Y,,,
,,Represent and summarize data and justify the representation,,,Y,,,
,,"Analyze the distribution characteristics of quantitative data, including determining the possible existence and impact of outliers",,,Y,,,
,,Compare and contrast different graphical or visual representations given the same data set,,,Y,,,
111.47.7,Bivariate data. The student applies the mathematical process standards to analyze relationships among bivariate quantitative data. ,"Analyze scatterplots for patterns, linearity, outliers, and influential points",,,Y,,,
,,,,,,,,
1A-A-3-5,Decompose (break down) a larger problem into smaller sub-problems with teacher guidance or independently,,,,Y,,,
1A-D-7-12,Collect data over time and organize it in a chart or graph in order to make a prediction.,,,,N,,,
1A-D-4-13 ,"Use a computing device to store, search, retrieve, modify, and delete information and define the information stored as data.",,,,Y,,,
1A-D-7-15 ,"Compare and contrast examples of how computing technology has changed and improved the way people live, work, and interact. ",,,,N,,,
1B-A-2-1 ,Apply collaboration strategies to support problem solving within the design cycle of a program.,,,,Y,,,
1B-A-5-4 ,"Construct programs, in order to solve a problem or for creative expression, that include sequencing, events, loops, conditionals, parallelism, and variables, using a block-based visual programming language or text-based language, both independently and collaboratively (e.g., pair programming)",,,,Y,,,
1B-A-3-6 ,"Decompose (break down) a larger problem into smaller sub-problems, independently or in a collaborative group",,,,Y,,,
1B-A-3-7,"Construct and execute an algorithm (set of step-by-step instructions) that includes sequencing, loops, and conditionals to accomplish a task, both independently and collaboratively, with or without a computing device.",,,,Y,,,
1B-A-6-8 ,"Analyze and debug (fix) an algorithm that includes sequencing, events, loops, conditionals, parallelism, and variables. ",,,,Y,,,
1B-D-5-12 ,"Create a computational artifact to model the attributes and behaviors associated with a concept (e.g., solar system, life cycle of a plant).",,,,Y,,,
1B-D-5-13 ,"Answer a question by using a computer to manipulate (e.g., sort, total and/or average, chart, graph) and analyze data that has been collected by the class or student.",,,,Y,,,
2-A-7-4,"Interpret the flow of execution of algorithms and predict their outcomes. [Clarification: Algorithms can be expressed using natural language, flow and control diagrams, comments within code, and pseudocode.]",,,,Y,,,
2-A-5-5 ,"Design, develop, and present computational artifacts such as mobile applications that address social problems both independently and collaboratively.",,,,Y,,,
2-A-5-6,"Develop programs, both independently and collaboratively, that include sequences with nested loops and multiple branches. [Clarification: At this level, students may use blockbased and/or text-based programming languages.]",,,,Y,,,
2-A-3-9 ,Decompose a problem into parts and create solutions for each part.,,,,Y,,,
2-D-7-15,"Explain the processes used to collect, transform, and analyze data to solve a problem using computational tools (e.g., use an app or spreadsheet form to collect data, decide which data to use or ignore, and choose a visualization method.).",,,,N,,,
2-I-7-18 ,"Summarize negative and positive impacts of using data and information to categorize people, predict behavior, and make recommendations based on those predictions (e.g., customizing search results or targeted advertising, based on previous browsing history, can save search time and limit options at the same time).",,,,N,,,
3A-A-3-10 ,"Design algorithms using sequence, selection, and iteration. ",,,,Y,,,
3A-A-3-11,"Explain and demonstrate how modeling and simulation can be used to explore natural phenomena (e.g., flocking behaviors, queueing, life cycles).",,,,N,,,
3A-D-3-21 ,"Apply basic techniques for locating and collecting small- and large-scale data sets (e.g., creating and distributing user surveys, accessing real-world data sets). ",,,,N,,,
3B-D-4-26 ,"Evaluate the ability of models and simulations to formulate, refine, and test hypotheses. ",,,,N,,,
3B-D-4-27 ,"Use various data collection techniques for different types of problems (e.g., mobile device GPS, user surveys, embedded system sensors, open data sets, social media data sets). ",,,,N,,,
Creativity 1.1.1,Apply a creative development process when creating computational artifacts.,"A creative process in the development of a computational artifact can include, but is not limited to, employing nontraditional, nonprescribed techniques; the use of novel combinations of artifacts, tools, and techniques; and the exploration of personal curiosities.",N,,,,,
,,Creating computational artifacts employs an iterative and often exploratory process to translate ideas into tangible form.,N,,,,,
Creativity 1.2.1,Create a computational artifact for creative expression.,"A computational artifact is anything created by a human using a computer and can be, but is not limited to, a program, an image, audio, video, a presentation, or a web page file.",N,,,,,
,,Creating computational artifacts requires understanding and using software tools and services.,N,,,,,
,,"Computing tools and techniques are used to create computational artifacts and can include, but are not limited to, programming IDEs, spreadsheets, 3D printers, or text editors.",N,,,,,
,,"A creatively developed computational artifact can be created by using nontraditional, nonprescribed computing techniques.",N,,,,,
,,Creative expressions in a computational artifact can reflect personal expressions of ideas or interests.,N,,,,,
Creativity 1.2.2,Create a computational artifact using computing tools and techniques to solve a problem.,Computing tools and techniques can enhance the process of finding a solution to a problem.,N,,,,,
,,A creative development process for creating computational artifacts can be used to solve problems when traditional or prescribed computing techniques are not effective.,N,,,,,
Creativity 1.2.3,Create a new computational artifact by combining or modifying existing artifacts.,Creating computational artifacts can be done by combining and modifying existing artifacts or by creating new artifacts.,N,,,,,
,,Computation facilitates the creation and modification of computational artifacts with enhanced detail and precision.,N,,,,,
,,Combining or modifying existing artifacts can show personal expression of ideas.,N,,,,,
Creativity 1.2.4,Collaborate in the creation of computational artifacts.,A collaboratively created computational artifact reflects effort by more than one person.,N,,,,,
,,Effective collaborative teams consider the use of online collaborative tools.,N,,,,,
,,"Effective collaborative teams practice interpersonal communication, consensus building, conflict resolution, and negotiation.",N,,,,,
,,Effective collaboration strategies enhance performance.,N,,,,,
,,Collaboration facilitates the application of multiple perspectives (including sociocultural perspectives) and diverse talents and skills in developing computational artifacts.,N,,,,,
,,A collaboratively created computational artifact can reflect personal expressions of ideas.,N,,,,,
Creativity 1.2.5,"Analyze the correctness, usability, functionality, and suitability of computational artifacts.","The context in which an artifact is used determines the correctness, usability, functionality, and suitability of the artifact.",N,,,,,
,,"A computational artifact may have weaknesses, mistakes, or errors depending on the type of artifact.",N,,,,,
,,The functionality of a computational artifact may be related to how it is used or perceived.,N,,,,,
,,The suitability (or appropriateness) of a computational artifact may be related to how it is used or perceived.,N,,,,,
Creativity 1.3.1,Use computing tools and techniques for creative expression.,"Creating digital effects, images, audio, video, and animations has transformed industries.",N,,,,,
,,"Digital audio and music can be created by synthesizing sounds, sampling existing audio and music, and recording and manipulating sounds, including layering and looping.",N,,,,,
,,"Digital images can be created by generating pixel patterns, manipulating existing digital images, or combining images.",N,,,,,
,,Digital effects and animations can be created by using existing software or modified software that includes functionality to implement the effects and animations.,N,,,,,
,,Computing enables creative exploration of both real and virtual phenomena.,N,,,,,
Abstraction 2.1.1,Describe the variety of abstractions used to represent data.,Digital data is represented by abstractions at different levels.,N,,,,,
,,"At the lowest level, all digital data are represented by bits.",N,,,,,
,,"At a higher level, bits are grouped to represent abstractions, including but not limited to numbers, characters, and color.",N,,,,,
,,"Number bases, including binary, decimal, and hexadecimal, are used to represent and investigate digital data.",N,,,,,
,,"At one of the lowest levels of abstraction, digital data is represented in binary (base 2) using only combinations of the digits zero and one.",N,,,,Exclusion Statement (2.1.1E): Two‹ês complement conversions are beyond the scope of this course and the AP Exam.,
,,Hexadecimal (base 16) is used to represent digital data because hexadecimal representation uses fewer digits than binary.,N,,,,,
,,Numbers can be converted from any base to any other base.,N,,,,,
Abstraction 2.1.2,Explain how binary sequences are used to represent digital data.,A finite representation is used to model the infinite mathematical concept of a number.,N,,,,Exclusion Statement (2.1.2): Binary representations of scientific notation are beyond the scope of this course and the AP Exam.,
