Objective Tag,Objective Description,Evidence Statements,In BS1,In BS2,In DS,In CSP,CSP-Exclusions,Notes
,,"In many programming languages, the fixed number of bits used to represent characters or integers limits the range of integer values and mathematical operations; this limitation can result in overflow or other errors.",N,,,,"Exclusion Statement (2.1.2B): Range limitations of any one language, compiler, or architecture are beyond the scope of this course and the AP Exam.",
,,"In many programming languages, the fixed number of bits used to represent real numbers (as floating-point numbers) limits the range of floating- point values and mathematical operations; this limitation can result in round-off and other errors.",N,,,,,
,,The interpretation of a binary sequence depends on how it is used.,N,,,,,
,,A sequence of bits may represent instructions or data.,N,,,,,
,,A sequence of bits may represent different types of data in different contexts.,N,,,,,
Abstraction 2.2.1,Develop an abstraction when writing a program or creating other computational artifacts.,The process of developing an abstraction involves removing detail and generalizing functionality.,N,,,,,
,,An abstraction extracts common features from specific examples in order to generalize concepts.,N,,,,,
,,An abstraction generalizes functionality with input parameters that allow software reuse.,N,,,,Exclusion Statement (2.2.1C): An understanding of the difference between value and reference parameters is beyond the scope of this course and the AP Exam.,
Abstraction 2.2.2,Use multiple levels of abstraction to write programs.,"Software is developed using multiple levels of abstractions, such as constants, expressions, statements, procedures, and libraries.",N,,,,,
,,Being aware of and using multiple levels of abstraction in developing programs helps to more effectively apply available resources and tools to solve problems.,N,,,,,
Abstraction 2.2.3,Identify multiple levels of abstractions that are used when writing programs.,Different programming languages offer different levels of abstraction.,N,,,,Exclusion Statement (2.2.3): Knowledge of the abstraction capabilities of all programming languages is beyond the scope of this course and the AP Exam.,
,,High-level programming languages provide more abstractions for the programmer and make it easier for people to read and write a program.,N,,,,,
,,Code in a programming language is often translated into code in another (lower-level) language to be executed on a computer.,N,,,,,
,,"In an abstraction hierarchy, higher levels of abstraction (the most general concepts) would be placed toward the top and lower-level abstractions (the more specific concepts) toward the bottom.",N,,,,,
,,"Binary data is processed by physical layers of computing hardware, including gates, chips, and components.",N,,,,,
,,A logic gate is a hardware abstraction that is modeled by a Boolean function.,N,,,,Exclusion Statement (2.2.3F): Memorization of specific gate visual representations is beyond the scope of this course and the AP Exam.,
,,A chip is an abstraction composed of low- level components and circuits that perform a specific function.,N,,,,,
,,A hardware component can be low level like a transistor or high level like a video card.,N,,,,,
,,"Hardware is built using multiple levels of abstractions, such as transistors, logic gates, chips, memory, motherboards, special purposes cards, and storage devices.",N,,,,,
,,"Applications and systems are designed, developed, and analyzed using levels of hardware, software, and conceptual abstractions.",N,,,,,
,,"Lower-level abstractions can be combined to make higher-level abstractions, such as short message services (SMS) or email messages, images, audio files, and videos",N,,,,,
Abstraction 2.3.1,Use models and simulations to represent phenomena.,Models and simulations are simplified representations of more complex objects or phenomena.,N,,,,,
,,Models may use different abstractions or levels of abstraction depending on the objects or phenomena being posed.,N,,,,,
,,Models often omit unnecessary features of the objects or phenomena that are being modeled.,N,,,,,
,,Simulations mimic real-world events without the cost or danger of building and testing the phenomena in the real world.,N,,,,,
Abstraction 2.3.2,"Use models and simulations to formulate, refine, and test hypotheses.",Models and simulations facilitate the formulation and refinement of hypotheses related to the objects or phenomena under consideration.,N,,,,,
,,Hypotheses are formulated to explain the objects or phenomena being modeled.,N,,,,,
,,Hypotheses are refined by examining the insights that models and simulations provide into the objects or phenomena.,N,,,,,
,,The results of simulations may generate new knowledge and new hypotheses related to the phenomena being modeled.,N,,,,,
,,Simulations allow hypotheses to be tested without the constraints of the real world.,N,,,,,
,,Simulations can facilitate extensive and rapid testing of models.,N,,,,,
,,"The time required for simulations is impacted by the level of detail and quality of the models, and the software and hardware used for the simulation.",N,,,,,
,,Rapid and extensive testing allows models to be changed to accurately reflect the objects or phenomena being modeled.,N,,,,,
Data 3.1.1,"Use computers to process information, find patterns, and test hypotheses about digitally processed information to gain insight and knowledge. [P4]",Computers are used in an iterative and interactive way when processing digital information to gain insight and knowledge.,N,,Y,,,
,,Digital information can be filtered and cleaned by using computers to process information.,N,,Y,,,
,,"Combining data sources, clustering data, and data classification are part of the process of using computers to process information.",N,,Y,,,
,,Insight and knowledge can be obtained from translating and transforming digitally represented information.,N,,Y,,,
,,Patterns can emerge when data is transformed using computational tools.,N,,Y,,,
Data 3.1.2,Collaborate when processing information to gain insight and knowledge.,Collaboration is an important part of solving data-driven problems.,N,,Y,,,
,,"Collaboration facilitates solving computational problems by applying multiple perspectives, experiences, and skill sets.",N,,Y,,,
,,Communication between participants working on data-driven problems gives rise to enhanced insights and knowledge.,N,,Y,,,
,,"Collaboration in developing hypotheses and questions, and in testing hypotheses and answering questions, about data helps participants gain insight and knowledge.",N,,Y,,,
,,Collaborating face-to-face and using online collaborative tools can facilitate processing information to gain insight and knowledge.,N,,Y,,,
,,Investigating large data sets collaboratively can lead to insight and knowledge not obtained when working alone.,N,,Y,,,
Data 3.1.3,"Explain the insight and knowledge gained from digitally processed data by using appropriate visualizations, notations, and precise language.",Visualization tools and software can communicate information about data.,N,,Y,,,
,,"Tables, diagrams, and textual displays can be used in communicating insight and knowledge gained from data.",N,,Y,,,
,,Summaries of data analyzed computationally can be effective in communicating insight and knowledge gained from digitally represented information.,N,,Y,,,
,,Transforming information can be effective in communicating knowledge gained from data.,N,,Y,,,
,,Interactivity with data is an aspect of communicating.,N,,Y,,,
Data 3.2.1,"Extract information from data to discover and explain connections, patterns, or trends.",Large data sets provide opportunities and challenges for extracting information and knowledge.,N,,Y,,,
,,"Large data sets provide opportunities for identifying trends, making connections in data, and solving problems.",N,,Y,,,
,,Computing tools facilitate the discovery of connections in information within large data sets.,N,,Y,,,
,,Search tools are essential for efficiently finding information.,N,,N,,,
,,Information filtering systems are important tools for finding information and recognizing patterns in the information.,N,,Y,,,
,,"Software tools, including spreadsheets and databases, help to efficiently organize and find trends in information.",N,,Y,,Exclusion Statement (3.2.1F): Students are not expected to know specific formulas or options available in spreadsheet or database software packages..,
,,Metadata is data about data.,N,,N,,,
,,"Metadata can be descriptive data about an image, a Web page, or other complex objects.",N,,N,,,
,,Metadata can increase the effective use of data or data sets by providing additional information about various aspects of that data.,N,,N,,,
Data 3.2.2,Use large data sets to explore and discover information and knowledge.,"Large data sets include data such as transactions, measurements, text, sound, images, and video.",N,,N,,,
,,"The storing, processing, and curating of large data sets is challenging.",N,,N,,,
,,Structuring large data sets for analysis can be challenging.,N,,N,,,
,,Maintaining privacy of large data sets containing personal information can be challenging.,N,,N,,,
,,Scalability of systems is an important consideration when data sets are large.,N,,N,,,
,,The size or scale of a system that stores data affects how that data set is used.,N,,N,,,
,,The effective use of large data sets requires computational solutions.,N,,N,,,
,,"Analytical techniques to store, manage, transmit, and process data sets change as the size of data sets scale.",N,,N,,,
Data 3.3.1,"Analyze how data representation, storage, security, and transmission of data involve computational manipulation of information. ","Digital data representations involve trade- offs related to storage, security, and privacy concerns.",N,,N,,,
,,Security concerns engender trade-offs in storing and transmitting information.,N,,N,,,
,,There are trade-offs in using lossy and lossless compression techniques for storing and transmitting data.,N,,N,,,
,,Lossless data compression reduces the number of bits stored or transmitted but allows complete reconstruction of the original data.,N,,N,,,
,,Lossy data compression can significantly reduce the number of bits stored or transmitted at the cost of being able to reconstruct only an approximation of the original data.,N,,N,,,
,,Security and privacy concerns arise with data containing personal information.,N,,N,,,
,,"Data is stored in many formats depending on its characteristics (e.g., size and intended use).",N,,N,,,
,,The choice of storage media affects both the methods and costs of manipulating the data it contains.,N,,N,,,
,,Reading data and updating data have different storage requirements.,N,,N,,,
Algorithms 4.1.1,Develop an algorithm for implementation in a program. ,"Sequencing, selection, and iteration are building blocks of algorithms.",N,,,,,
,,Sequencing is the application of each step of an algorithm in the order in which the statements are given.,N,,,,,
,,Selection uses a Boolean condition to determine which of two parts of an algorithm is used.,N,,,,,
,,Iteration is the repetition of part of an algorithm until a condition is met or for a specified number of times.,N,,,,,
,,Algorithms can be combined to make new algorithms.,N,,,,,
,,Using existing correct algorithms as building blocks for constructing a new algorithm helps ensure the new algorithm is correct.,N,,,,,
,,Knowledge of standard algorithms can help in constructing new algorithms.,N,,,,,
,,Different algorithms can be developed to solve the same problem.,N,,,,,
,,Developing a new algorithm to solve a problem can yield insight into the problem.,N,,,,,
Algorithms 4.1.2,Express an algorithm in a language. ,"Languages for algorithms include natural language, pseudocode, and visual and textual programming languages.",N,,,,,
,,Natural language and pseudocode describe algorithms so that humans can understand them.,N,,,,,
,,Algorithms described in programming languages can be executed on a computer.,N,,,,,
,,Different languages are better suited for expressing different algorithms.,N,,,,,
,,Some programming languages are designed for specific domains and are better for expressing algorithms in those domains.,N,,,,,
,,The language used to express an algorithm can affect characteristics such as clarity or readability but not whether an algorithmic solution exists.,N,,,,,
,,"Every algorithm can be constructed using only sequencing, selection, and iteration.",N,,,,,
,,Nearly all programming languages are equivalent in terms of being able to express any algorithm.,N,,,,,
,,Clarity and readability are important considerations when expressing an algorithm in a language.,N,,,,,
Algorithms 4.2.1,Explain the difference between algorithms that run in a reasonable time and those that do not run in a reasonable time.,Many problems can be solved in a reasonable time.,N,,,,Exclusion Statement (LO 4.2.1): Any discussion of nondeterministic polynomial (NP) is beyond the scope of this course and the AP Exam.,
,,"Reasonable time means that as the input size grows, the number of steps the algorithm takes is proportional to the square (or cube, fourth power, fifth power, etc.) of the size of the input.",N,,,,,
,,"Some problems cannot be solved in a reasonable time, even for small input sizes.",N,,,,,
,,"Some problems can be solved but not in a reasonable time. In these cases, heuristic approaches may be helpful to find solutions in reasonable time.",N,,,,,
Algorithms 4.2.2,Explain the difference between solvable and unsolvable problems in computer science. ,A heuristic is a technique that may allow us to find an approximate solution when typical methods fail to find an exact solution.,N,,,,Exclusion Statement (LO 4.2.2): Determining whether a given problem is solvable or unsolvable is beyond the scope of this course and the AP Exam.,
,,Heuristics may be helpful for finding an approximate solution more quickly when exact methods are too slow.,N,,,,Exclusion Statement (4.2.2B): Specific heuristic solutions are beyond the scope of this course and the AP Exam.,
,,"Some optimization problems such as _find the bestŠ— or _find the smallestŠ— cannot be solved in a reasonable time, but approximations to the optimal solution can.",N,,,,,
,,Some problems cannot be solved using any algorithm.,N,,,,,
Algorithms 4.2.3,Explain the existence of undecidable problems in computer science. ,"An undecidable problem may have instances that have an algorithmic solution, but there is no algorithmic solution that solves all instances of the problem.",N,,,,,
,,"A decidable problem is one in which an algorithm can be constructed to answer _yesŠ— or _noŠ— for all inputs (e.g., _is the number even?Š—).",N,,,,,
,,An undecidable problem is one in which no algorithm can be constructed that always leads to a correct yes-or-no answer.,N,,,,Exclusion Statement (4.2.3C): Determining whether a given problem is undecidable is beyond the scope of this course and the AP Exam.,
Algorithms 4.2.4,"Evaluate algorithms analytically and empirically for efficiency, correctness, and clarity.",Determining an algorithm‹ês efficiency is done by reasoning formally or mathematically about the algorithm.,N,,,,,
,,Empirical analysis of an algorithm is done by implementing the algorithm and running it on different inputs.,N,,,,,
,,"The correctness of an algorithm is determined by reasoning formally or mathematically about the algorithm, not by testing an implementation of the algorithm.",N,,,,Exclusion statement (4.2.4C): Formally proving program correctness is beyond the scope of this course and the AP Exam.,
,,Different correct algorithms for the same problem can have different efficiencies.,N,,,,,
,,Sometimes more efficient algorithms are more complex.,N,,,,,
,,Finding an efficient algorithm for a problem can help solve larger instances of the problem.,N,,,,,
,,Efficiency includes both execution time and memory usage.,N,,,,Exclusion Statement (4.2.4G): Formal analysis of algorithms (Big-O) and formal reasoning using mathematical formulas are beyond the scope of this course and the AP Exam.,
,,Linear search can be used when searching for an item in any list; binary search can be used only when the list is sorted.,N,,,,,
Programming 5.1.1,"Develop a program for creative expression, to satisfy personal curiosity, or to create new knowledge. ",Programs are developed and used in a variety of ways by a wide range of people depending on the goals of the programmer.,N,,,,,
,,"Programs developed for creative expression, to satisfy personal curiosity, or to create new knowledge may have visual, audible, or tactile inputs and outputs.",N,,,,,
,,"Programs developed for creative expression, to satisfy personal curiosity, or to create new knowledge may be developed with different standards or methods than programs developed for widespread distribution.",N,,,,,
,,Additional desired outcomes may be realized independently of the original purpose of the program.,N,,,,,
,,"A computer program or the results of running a program may be rapidly shared with a large number of users and can have widespread impact on individuals, organizations, and society.",N,,,,,
,,Advances in computing have generated and increased creativity in other fields.,N,,,,,
Programming 5.1.2,Develop a correct program to solve problems.,An iterative process of program development helps in developing a correct program to solve problems.,N,,,,,
,,Developing correct program components and then combining them helps in creating correct programs.,N,,,,,
,,"Incrementally adding tested program segments to correct, working programs helps create large correct programs.",N,,,,,
,,Program documentation helps programmers develop and maintain correct programs to efficiently solve problems.,N,,,,,
,,"Documentation about program components, such as blocks and procedures, helps in developing and maintaining programs.",N,,,,,
,,Documentation helps in developing and maintaining programs when working individually or in collaborative programming environments.,N,,,,,
,,Program development includes identifying programmer and user concerns that affect the solution to problems.,N,,,,,
,,Consultation and communication with program users is an important aspect of program development to solve problems.,N,,,,,
,,A programmer‹ês knowledge and skill affects how a program is developed and how it is used to solve a problem.,N,,,,,
,,"A programmer designs, implements, tests, debugs, and maintains programs when solving problems.",N,,,,,
Programming 5.1.3,Collaborate to develop a program.,Collaboration can decrease the size and complexity of tasks required of individual programmers.,N,,,,,
,,Collaboration facilitates multiple perspectives in developing ideas for solving problems by programming.,N,,,,,
,,Collaboration in the iterative development of a program requires different skills than developing a program alone.,N,,,,,
,,Collaboration can make it easier to find and correct errors when developing programs.,N,,,,,
,,Collaboration facilitates developing program components independently.,N,,,,,
,,Effective communication between participants is required for successful collaboration when developing programs.,N,,,,,
Programming 5.2.1,Explain how programs implement algorithms.,Algorithms are implemented using program instructions that are processed during program execution.,N,,,,,
,,Program instructions are executed sequentially.,N,,,,,
,,"Program instructions may involve variables that are initialized and updated, read, and written.",N,,,,,
,,An understanding of instruction processing and program execution is useful for programming.,N,,,,,
,,Program execution automates processes.,N,,,,,
,,"Processes use memory, a central processing unit (CPU), and input and output.",N,,,,,
,,A process may execute by itself or with other processes.,N,,,,,
,,A process may execute on one or several CPUs.,N,,,,,
,,Executable programs increase the scale of problems that can be addressed.,N,,,,,
,,Simple algorithms can solve a large set of problems when automated.,N,,,,,
,,"Improvements in algorithms, hardware, and software increase the kinds of problems and the size of problems solvable by programming.",N,,,,,
Programming 5.3.1,Use abstraction to manage complexity in programs. ,Procedures are reusable programming abstractions.,N,,,,,
,,A function is a named grouping of programming instructions.,N,,,,,
,,Procedures reduce the complexity of writing and maintaining programs.,N,,,,,
,,Procedures have names and may have parameters and return values.,N,,,,,
,,Parameterization can generalize a specific solution.,N,,,,,
,,Parameters generalize a solution by allowing a function to be used instead of duplicated code.,N,,,,,
,,Parameters provide different values as input to procedures when they are called in a program.,N,,,,,
,,Data abstraction provides a means of separating behavior from implementation.,N,,,,,
,,"Strings and string operations, including concatenation and some form of substring, are common in many programs.",N,,,,,
,,Integers and floating-point numbers are used in programs without requiring understanding of how they are implemented.,N,,,,,
,,"Lists and list operations, such as add, remove, and search, are common in many programs.",N,,,,,
,,Using lists and procedures as abstractions in programming can result in programs that are easier to develop and maintain.,N,,,,,
,,Application program interfaces (APIs) and libraries simplify complex programming tasks.,N,,,,,
,,Documentation for an API/library is an important aspect of programming.,N,,,,,
,,"APIs connect software components, allowing them to communicate.",N,,,,,
Programming 5.4.1,Evaluate the correctness of a program.,Program style can affect the determination of program correctness.,N,,,,,
,,Duplicated code can make it harder to reason about a program.,N,,,,,
,,Meaningful names for variables and procedures help people better understand programs.,N,,,,,
,,Longer code blocks are harder to reason about than shorter code blocks in a program.,N,,,,,
,,Locating and correcting errors in a program is called debugging the program.,N,,,,,
,,Knowledge of what a program is supposed to do is required in order to find most program errors.,N,,,,,
,,Examples of intended behavior on specific inputs help people understand what a program is supposed to do.,N,,,,,
,,Visual displays (or different modalities) of program state can help in finding errors.,N,,,,,
,,Programmers justify and explain a program‹ês correctness.,N,,,,,
,,Justification can include a written explanation about how a program meets its specifications.,N,,,,,
,,"Correctness of a program depends on correctness of program components, including code blocks and procedures.",N,,,,,
,,An explanation of a program helps people understand the functionality and purpose of it.,N,,,,,
,,The functionality of a program is often described by how a user interacts with it.,N,,,,,
,,"The functionality of a program is best described at a high level by what the program does, not at the lower level of how the program statements work to accomplish this.",N,,,,,
Programming 5.5.1,Employ appropriate mathematical and logical concepts in programming. ,Numbers and numerical concepts are fundamental to programming.,N,,,,,
,,Integers may be constrained in the maximum and minimum values that can be represented in a program because of storage limitations.,N,,,,Exclusion Statement (5.5.1B): Specific range limitations of all programming languages are beyond the scope of this course and the AP Exam.,
,,Real numbers are approximated by floating- point representations that do not necessarily have infinite precision.,N,,,,Exclusion Statement (5.5.1C): Specific sets of values that cannot be exactly represented by floating point numbers are beyond the scope of this course and the AP Exam.,
,,Mathematical expressions using arithmetic operators are part of most programming languages.,N,,,,,
,,Logical concepts and Boolean algebra are fundamental to programming.,N,,,,,
,,"Compound expressions using and, or, and not are part of most programming languages.",N,,,,,
,,Intuitive and formal reasoning about program components using Boolean concepts helps in developing correct programs.,N,,,,,
,,Computational methods may use lists and collections to solve problems.,N,,,,,
,,Lists and other collections can be treated as abstract data types (ADTs) in developing programs.,N,,,,,
,,"Basic operations on collections include adding elements, removing elements, iterating over all elements, and determining whether an element is in a collection.",N,,,,,
Internet 6.1.1,Explain the abstractions in the Internet and how the Internet functions.,The Internet connects devices and networks all over the world.,N,,,,Exclusion Statement (LO 6.1.1): Specific devices used to implement the abstractions in the Internet are beyond the scope of this course and the AP Exam.,
,,An end-to-end architecture facilitates connecting new devices and networks on the Internet.,N,,,,,
,,Devices and networks that make up the Internet are connected and communicate using addresses and protocols.,N,,,,,
,,The Internet and the systems built on it facilitate collaboration.,N,,,,,
,,Connecting new devices to the Internet is enabled by assignment of an Internet protocol (IP) address.,N,,,,,
,,"The Internet is built on evolving standards, including those for addresses and names.",N,,,,Exclusion Statement (6.1.1F): Specific details of any particular standard for addresses are beyond the scope of this course and the AP Exam.,
,,The domain name system (DNS) translates names to IP addresses.,N,,,,,
